{
  "id": "sotapatti_magga",
  "title": "Lộ Trình Nhập Lưu — Đoạn Trừ 3 Hạ Phần Kiết Sử",
  "titleEn": "Stream-Entry Roadmap — Severing 3 Lower Fetters",
  "paliTitle": "Sotāpatti Magga",
  "subtitle": "Phá Hoài Nghi, Giới Cấm Thủ & Thân Kiến qua Chánh Pháp Pāḷi",
  "subtitleEn": "Overcoming Doubt, Rites/Rituals & Self-Identity View",
  "description": "Lộ trình tu học và thực hành căn bản nhưng cốt tủy của Phật giáo Nguyên thủy Theravāda. Giúp hành giả thấu suốt Tứ Diệu Đế, Duyên Khởi, đoạn trừ hoài nghi, thành tựu 4 Chi phần Nhập lưu và an trú trong Tứ Niệm Xứ.",
  "descriptionEn": "Fundamental yet essential roadmap of Early Theravāda Buddhism. Guides practitioners through the Four Noble Truths, Dependent Origination, overcoming doubts, establishing 4 factors of stream-entry, and abiding in Satipaṭṭhāna.",
  "category": "sotapatti",
  "iconEmoji": "🌟",
  "estimatedDuration": "19 bài / 4 Chặng",
  "estimatedDurationEn": "19 Lessons / 4 Phases",
  "canonicalSource": "Tam Tạng Pāḷi (Tipiṭaka - Sutta Piṭaka):\n• Tương Ưng Bộ (Saṃyutta Nikāya): SN 55 (Dự Lưu), SN 56 (Sự Thật), SN 12 (Duyên Khởi), SN 22 (Uẩn), SN 45 (Đạo)\n• Trung Bộ (Majjhima Nikāya): MN 9 (Chánh Tri Kiến), MN 10 (Niệm Xứ), MN 19 (Tư Duy), MN 57 (Khổ Hạnh), MN 141 (Phân Biệt Sự Thật)\n• Tăng Chi Bộ (Aṅguttara Nikāya): AN 3.65 (Kālāma Sutta), AN 4.13 (Chánh Cần), AN 5.177 (Chánh Mạng), AN 10.176 (Thập Nghiệp Đạo)\n• Trường Bộ (Dīgha Nikāya): DN 22 (Đại Niệm Xứ)",
  "canonicalSourceEn": "Pāḷi Canon (Tipiṭaka - Sutta Piṭaka):\n• Saṃyutta Nikāya: SN 55 (Sotāpatti), SN 56 (Sacca), SN 12 (Paṭiccasamuppāda), SN 22 (Khandha), SN 45 (Magga)\n• Majjhima Nikāya: MN 9 (Sammādiṭṭhi), MN 10 (Satipaṭṭhāna), MN 19 (Dvedhāvitakka), MN 57 (Kukkuravatika), MN 141 (Saccavibhaṅga)\n• Aṅguttara Nikāya: AN 3.65 (Kālāma Sutta), AN 4.13 (Padhāna), AN 5.177 (Vaṇijjā), AN 10.176 (Cunda)\n• Dīgha Nikāya: DN 22 (Mahāsatipaṭṭhāna Sutta)",
  "traditionLineage": "Phật giáo Nguyên thủy Theravāda chính thống:\n• Thứ Đệ Thuyết Pháp (Anupubbikathā)\n• Pháp Hành Tứ Niệm Xứ (Satipaṭṭhāna Vipassanā)\n• 37 Phẩm Trợ Đạo (Bodhipakkhiyadhamma)\n• Mục Tiêu Tối Thượng: Đoạn trừ 3 Hạ phần kiết sử (Thân kiến, Hoài nghi, Giới cấm thủ)",
  "traditionLineageEn": "Authentic Theravāda Early Buddhism:\n• Gradual Discourse (Anupubbikathā)\n• Four Foundations of Mindfulness (Satipaṭṭhāna Vipassanā)\n• 37 Aids to Awakening (Bodhipakkhiyadhamma)\n• Supreme Goal: Severing the 3 Lower Fetters (Sakkāya-diṭṭhi, Vicikicchā, Sīlabbata-parāmāsa)",
  "targetAudience": "• Người học Phật muốn trang bị Chánh tri kiến vững chắc, thoát khỏi mê tín dị đoan.\n• Hành giả muốn tự mình khảo nghiệm, chứng ngộ Chánh Pháp theo tinh thần Kālāma.\n• Người phát nguyện đoạn trừ 3 kiết sử và bước vào dòng Thánh Nhập Lưu bất thối chuyển.",
  "targetAudienceEn": "• Practitioners seeking steadfast Right View and freedom from superstition.\n• Seekers wishing to verify and realize the Dhamma empirically per Kālāma.\n• Aspirants resolving to sever 3 lower fetters and attain irreversible Stream-Entry.",
  "stages": [
    {
      "stageIndex": 1,
      "title": "Chặng 1: Cửa Ngõ Nhập Lưu & Xây Dựng Chánh Tín",
      "titleEn": "Phase 1: Gateway to Stream-Entry & Establishing Noble Faith",
      "paliTitle": "Sotāpattiyaṅga & Saddhā",
      "objective": "Hiểu rõ 4 điều kiện tiên quyết vào dòng Thánh, xác lập Chánh tín thực nghiệm qua tinh thần Kinh Kālāma và an trú niềm tin bất động nơi Tam Bảo.",
      "objectiveEn": "Comprehend the 4 prerequisites for entering the stream, establish experiential faith through the Kālāma inquiry, and anchor unshakeable confidence in the Triple Gem.",
      "lessons": [
        {
          "id": "sotapatti_l01",
          "lessonNumber": 1,
          "title": "Bài 1: Bốn Chi Phần Nhập Lưu (Sotāpattiyaṅga) — Hạt Giống Ban Đầu",
          "titleEn": "Lesson 1: 4 Factors for Stream-Entry (Sotāpattiyaṅga) — The Initial Seeds",
          "paliTitle": "Sāriputtasutta (SN 55.5)",
          "summary": "Bốn yếu tố tiên quyết vào dòng Thánh: Thân cận bậc chân nhân, Lắng nghe Diệu pháp, Như lý tác ý, và Pháp tùy pháp hành.",
          "summaryEn": "Four prerequisite factors for entering the stream: Associating with true persons, hearing the true Dhamma, wise reflection, and practicing in accordance with the Dhamma.",
          "suttaUid": "sn55.5",
          "suttaTitle": "Kinh Bốn Chi Phần Nhập Lưu (SN 55.5)",
          "suttaTitleEn": "Factors for Stream-Entry (SN 55.5)",
          "recommendedRoutineId": "r_morning",
          "practiceGuide": "Thực hành Như lý tác ý (Yonisomanasikāra): Đặt tâm quan sát mọi sự kiện trong ngày qua lăng kính Duyên sinh và Nghiệp báo thay vì phản ứng theo thói quen bản ngã.",
          "practiceGuideEn": "Practice Wise Reflection (Yonisomanasikāra): Frame daily encounters through conditionality and karma rather than egoic reaction.",
          "reflectionPrompt": "Hôm nay nguồn tri thức và người bạn tiếp xúc có giúp tâm bạn lắng dịu, sáng tỏ hay kích động thêm tham sân si?",
          "reflectionPromptEn": "Did the information sources and companions you engaged with today bring calmness and clarity, or agitate greed and aversion?",
          "suggestedVirtue": "Thân cận thiện tri thức & Lắng nghe Chánh pháp với tâm như lý tác ý",
          "suggestedVirtueEn": "Associate with the wise & listen to Dhamma with wise reflection"
        },
        {
          "id": "sotapatti_l02",
          "lessonNumber": 2,
          "title": "Bài 2: Thước Đo Chân Lý — Tinh Thần Kinh Kālāma",
          "titleEn": "Lesson 2: Yardstick of Truth — The Spirit of Kālāma Sutta",
          "paliTitle": "Kesamuttisutta (AN 3.65)",
          "summary": "Mười tiêu chuẩn không vội tin; kiểm nghiệm giáo pháp qua hiệu quả thực chứng: Ly Tham, Ly Sân, Ly Si, đem lại an lạc cho mình và người.",
          "summaryEn": "Ten criteria of non-blind belief; verifying teachings via direct experiential test: freedom from greed, hatred, delusion, yielding genuine welfare.",
          "suttaUid": "an3.65",
          "suttaTitle": "Kinh Kālāma (AN 3.65)",
          "suttaTitleEn": "Discourse to the Kālāmas (AN 3.65)",
          "recommendedRoutineId": "r_evening",
          "practiceGuide": "Khảo sát và gạn lọc: Nhận diện một niềm tin hoặc nỗi sợ hãi tâm linh vô căn cứ (xem bói, phong thủy, kiêng kỵ) và buông xả bằng Chánh tri kiến.",
          "practiceGuideEn": "Examine and filter: Identify an unfounded superstition (fortune-telling, taboos) and discard it under Right View.",
          "reflectionPrompt": "Bạn có đang bám víu vào bất kỳ nghi thức cầu xin hay niềm tin mù quáng nào đi ngược lại quy luật Nhân Quả không?",
          "reflectionPromptEn": "Are you clinging to any prayer rituals or superstitious beliefs that contradict the law of Karma?",
          "suggestedVirtue": "Dứt bỏ mê tín dị đoan, thẩm định niềm tin bằng Chánh kiến",
          "suggestedVirtueEn": "Abandon superstition, testing beliefs through Right View"
        },
        {
          "id": "sotapatti_l03",
          "lessonNumber": 3,
          "title": "Bài 3: Niềm Tin Bất Động — Bốn Dự Lưu Chi Của Bậc Thánh",
          "titleEn": "Lesson 3: Unshakeable Confidence — The 4 Limbs of a Stream-Enterer",
          "paliTitle": "Cakkavattirājasutta (SN 55.1)",
          "summary": "Niềm tin thanh tịnh bất thối chuyển nơi Phật, Pháp, Tăng và thành tựu Giới hạnh mà các bậc Thánh hằng quý chuộng.",
          "summaryEn": "Unshakeable confidence in the Buddha, Dhamma, Sangha, and possessing virtues loved by the Noble Ones.",
          "suttaUid": "sn55.1",
          "suttaTitle": "Kinh Vua Chuyển Luân (SN 55.1)",
          "suttaTitleEn": "A Wheel-Turning Monarch (SN 55.1)",
          "recommendedRoutineId": "r_morning",
          "practiceGuide": "Tụng niệm và quán chiếu ân đức Tam Bảo cùng 5 Giới trong sáng trước khi bắt đầu ngày mới.",
          "practiceGuideEn": "Recite and contemplate the virtues of the Triple Gem and pristine five precepts before starting the day.",
          "reflectionPrompt": "Niềm tin của bạn nơi Tam Bảo có dựa trên trí tuệ và sự chuyển hóa cụ thể trong tâm, hay chỉ là cảm xúc nhất thời?",
          "reflectionPromptEn": "Is your faith in the Triple Gem grounded in wisdom and inner transformation, or mere transient emotion?",
          "suggestedVirtue": "An trú Chánh tín bất động nơi Tam Bảo và hộ trì Giới thanh tịnh",
          "suggestedVirtueEn": "Abide in unshakeable confidence in the Triple Gem and preserve pure morality"
        }
      ]
    },
    {
      "stageIndex": 2,
      "title": "Chặng 2: Thâm Nhập Tứ Thánh Đế",
      "titleEn": "Phase 2: Penetrating the Four Noble Truths",
      "paliTitle": "Cattāri Ariyasaccāni",
      "objective": "Liễu tri Khổ Thánh Đế, Đoạn tận Tập Thánh Đế (Tham ái & Duyên khởi), Chứng ngộ Diệt Thánh Đế (Niết-bàn) và Tu tập Đạo Thánh Đế (Bát Chánh Đạo).",
      "objectiveEn": "Fully understand Suffering, abandon its Origin (Craving & Conditionality), realize Cessation (Nibbāna), and cultivate the Path (Noble Eightfold Path).",
      "lessons": [
        {
          "id": "sotapatti_l04",
          "lessonNumber": 4,
          "title": "Bài 4: Khổ Thánh Đế (Dukkha Sacca) — Nhìn Thẳng Bản Chất Bất Toàn",
          "titleEn": "Lesson 4: The Truth of Suffering (Dukkha Sacca) — Confronting Inherent Imperfection",
          "paliTitle": "Dhammacakkappavattana Sutta (SN 56.11)",
          "summary": "Thấu triệt 3 cấp độ Khổ: Khổ khổ (đau đớn thể xác), Hoại khổ (sự biến đổi), Hành khổ (các pháp hữu vi do duyên sinh). Phận sự: Khổ cần phải Liễu tri (Pariññeyya).",
          "summaryEn": "Comprehending the 3 levels of Dukkha: intrinsic suffering, suffering of change, suffering of conditioned phenomena. Duty: To be fully understood (Pariññeyya).",
          "suttaUid": "sn56.11",
          "suttaTitle": "Kinh Chuyển Pháp Luân & Phân Biệt Sự Thật (SN 56.11 / MN 141)",
          "suttaTitleEn": "Setting the Wheel of Dhamma in Motion (SN 56.11 / MN 141)",
          "recommendedRoutineId": "r_breath",